{
  "book": {
    "detected_title": "Ginger the Giraffe",
    "language": "tr",
    "analysis_confidence": 0.95
  },
  "page_ordering": {
    "ordering_method": "narrative_inference",
    "confidence": 0.98
  },
  "pages": [
    {
      "page_id": "page_1",
      "page_number": 1,
      "order_index": 1,
      "order_confidence": 1,
      "full_text": "Zürafa Ginger\nYazan: T. Albert\nResimleyen: maaillustrations.com",
      "primary_scene_hint": "cover",
      "dominant_visual": "A tall giraffe standing in the rain with other savannah animals.",
      "mood": "magical"
    },
    {
      "page_id": "page_4",
      "page_number": 4,
      "order_index": 4,
      "order_confidence": 0.98,
      "full_text": "Bir varmış bir yokmuş, Ginger adında bir zürafa varmış. Ginger, Afrika'daki Kenya ülkesinde yaşarmış. Tüm zürafalar gibi Ginger'ın da uzun bir boynu ve uzun bacakları varmış. O kadar uzun olduğu için savandaki ağaçların en tepesinden yiyecek yiyebilirmiş. Afrika'daki savan, çok sayıda otun ve birkaç ağacın bulunduğu bir bölgedir. Bazen savana çayırlık da denir. Zebralar ve antiloplar gibi diğer hayvanlar Ginger'ın ulaşabildiği yere ulaşamazmış. Ama Ginger her zaman yiyecek bulurmuş. Ağaçların yapraklarını ve yeni tomurcuklarını çok severmiş.",
      "primary_scene_hint": "intro",
      "dominant_visual": "Two giraffes standing on a sunny savannah eating from tall trees.",
      "mood": "calm"
    },
    {
      "page_id": "page_5",
      "page_number": 5,
      "order_index": 5,
      "order_confidence": 0.98,
      "full_text": "Bir gün Ginger, diğer bazı zürafalarla birlikte en sevdiği yaprakları yemekle meşgulmüş. Pırıl pırıl güneşli bir gündü ve gökyüzünde tek bir bulut bile yoktu. Uzun zamandır yağmur yağmamıştı, bu yüzden otlar çok kuruydu. Upuzun bacaklarının dibinden bir ses duydu: arkadaşı Maymun Mickey'di. Mickey bir şeyler söylemeye çalışıyordu ama Ginger ne dediğini anlayamadı. Çok yorgun görünüyordu. 'Neyin var?' diye sordu Ginger. Ginger çok kibar bir zürafaydı ve herkese yardım etmek isterdi. Tam o sırada Mickey yıkıldı!",
      "primary_scene_hint": "mickey_falls",
      "dominant_visual": "Ginger looking down at Mickey the Monkey sitting tiredly on the dry grass.",
      "mood": "suspenseful"
    },
    {
      "page_id": "page_6",
      "page_number": 6,
      "order_index": 6,
      "order_confidence": 0.98,
      "full_text": "Ginger aynı zamanda akıllı bir zürafaydı. Sorunun ne olduğunu biliyordu. Mickey yiyecek bir şey bulamamış ve çok acıkmıştı. Ginger, yemek yediği ağacın tepesinden taze, körpe yapraklar ve tomurcuklar kopardı. Yaprakların ve tomurcukların bir kısmını Mickey'nin yanına, yere düşürdü. Sonra upuzun bacaklarından birinin ucundaki toynağıyla onu hafifçe dürttü. 'Uyan, Mickey!' dedi Ginger. 'Sana yiyecek bir şey buldum.' Mickey yavaşça doğruldu ve biraz yedi.",
      "primary_scene_hint": "feeding_mickey",
      "dominant_visual": "Ginger dropping leaves from the tree to a hungry Mickey.",
      "mood": "warm"
    },
    {
      "page_id": "page_7",
      "page_number": 7,
      "order_index": 7,
      "order_confidence": 0.98,
      "full_text": "Bir süre sonra Mickey kendini daha iyi hissedince, Ginger ona sordu: 'Ne oldu Mickey? Neden bu kadar açsın? Neden yiyecek bir şey bulamıyorsun?' Mickey, 'Uzun zamandır yağmur yağmadı ve artık yiyecek kalmadı,' dedi. 'Bu hiç iyi değil,' dedi Ginger. 'Diğer hayvanlara neler oluyor?' 'Kimse ne yapacağını bilmiyor,' diye cevapladı Mickey. 'Bütün zebralar, antiloplar ve filler kuru otlar yüzünden endişeleniyor. Bazıları savanı terk edip ormana ulaşmayı düşünüyor.' 'Bu uzun bir yolculuk,' dedi Ginger. 'Sen de onlarla gidecek misin?'",
      "primary_scene_hint": "drought_talk",
      "dominant_visual": "Ginger and Mickey conversing under a single tree in the dry savannah.",
      "mood": "mysterious"
    },
    {
      "page_id": "page_8",
      "page_number": 8,
      "order_index": 8,
      "order_confidence": 0.98,
      "full_text": "'Bilmiyorum,' diye cevapladı Mickey. 'Sence ne yapmalıyız?' Ginger bir süre düşündü ve sonra birden aklına iyi bir fikir geldi. 'Aslan Leo ile konuşmaya gitmeliyiz. O savandaki en akıllı hayvandır!' Mickey yürüyemeyecek kadar yorgundu, bu yüzden Ginger onu sırtına almayı teklif etti. 'Boynuma sıkıca tutun,' dedi Ginger. 'Tutunacak çok yer var,' diye şaka yaptı Mickey. Ginger güldü. 'Haklısın. Afrika'nın en uzun boynu bende!' Böylece Leo'yu aramak için savanın diğer tarafına doğru yolculuklarına başladılar.",
      "primary_scene_hint": "journey_starts",
      "dominant_visual": "Mickey riding on Ginger's neck across the plains.",
      "mood": "playful"
    },
    {
      "page_id": "page_9",
      "page_number": 9,
      "order_index": 9,
      "order_confidence": 0.98,
      "full_text": "Ginger ve Mickey şanslıydı! Leo bir kayanın üzerinde oturuyordu ve otların arasında yürürlerken onu görmek çok kolaydı. 'Merhaba Leo!' diye birlikte bağırdılar. Leo kestiriyordu ve onu uyandırdıklarında biraz huysuzlaştı. Ama nazikti ve şöyle dedi: 'Merhaba Ginger ve Mickey. Bütün savanı yürüyerek geçtiniz mi? Sırf beni uyandırmak için mi?' Ama şaka yapıyordu; yüzünde bir gülümseme vardı. 'Mickey, çok kurak olduğu için savanda yiyecek kalmadığını söylüyor,' dedi Ginger. 'Aklına bir fikir geliyor mu?'",
      "primary_scene_hint": "meeting_leo",
      "dominant_visual": "Leo the Lion yawning on a rock while Ginger and Mickey watch.",
      "mood": "warm"
    },
    {
      "page_id": "page_10",
      "page_number": 10,
      "order_index": 10,
      "order_confidence": 0.98,
      "full_text": "Leo bir süre düşündü. 'Yağmur konusunda yapabileceğimiz bir şey yok,' dedi. 'Yakında gelecek ama ne zaman geleceğinden emin olamayız. Yağmur geldiğinde tüm bitkiler yeniden büyüyecek ve herkese bol bol yiyecek olacak.' Biraz daha düşündü. 'Aklıma gelen tek şey, herkesin ormana yaklaşması,' diye devam etti. 'Orada yiyecek daha çok şey olacak, ama uzun bir yolculuk olduğunu ve pek kolay olmayacağını biliyorum. Oraya ulaşmak günler sürebilir.'",
      "primary_scene_hint": "leo_advice",
      "dominant_visual": "Leo sitting seriously on his rock giving advice to Ginger and Mickey.",
      "mood": "calm"
    },
    {
      "page_id": "page_11",
      "page_number": 11,
      "order_index": 11,
      "order_confidence": 0.98,
      "full_text": "Ginger ve Mickey birbirlerine baktılar ve sonra tekrar Leo'ya döndüler. 'Teşekkürler Leo,' dedi Ginger. 'Hepsinin ormana yaklaşmaya çalışması en iyisi olacak galiba.' Vedalaştılar ve savanı geçerek geri yürüdüler. Şimdi uzun yolculuğa başlamak için tüm hayvanları bir araya toplamaları gerekiyordu. Ginger'ın gitmesine gerek yoktu çünkü yüksek ağaçlarında bol bol yiyeceği vardı. Ama o iyi bir arkadaştı ve elinden geldiğince yardım etmek istiyordu. En sevdiği ağaçlara doğru yürüdüler ve tahmin edin Mickey ile ne gördüler?",
      "primary_scene_hint": "return_journey",
      "dominant_visual": "Ginger and Mickey walking away from Leo's rock into the distance.",
      "mood": "adventurous"
    },
    {
      "page_id": "page_12",
      "page_number": 12,
      "order_index": 12,
      "order_confidence": 0.98,
      "full_text": "Tüm hayvanlar çoktan orada toplanmış, Ginger ile Mickey'i bekliyordu! 'Neden hepiniz buradasınız?' diye sordu Ginger. 'Kartal Eddie bize, bizi ormanın kenarına götüreceğinizi söyledi,' dedi zebralardan biri. 'O nereden biliyor?' diye sordu Mickey. 'Sizin Leo ile konuşmanızı duydu,' dedi antiloplardan biri. 'Yani hepiniz birlikte ormana yürümeye karar mı verdiniz?' diye sordu Ginger. 'Evet,' diye cevap verdiler hep birlikte. 'Eğer oraya ulaşmamıza yardım edersen,' diye ekledi fillerden biri. 'Tabii ki yardım ederim,' dedi Ginger. 'Ben sizin arkadaşınızım.'",
      "primary_scene_hint": "animal_gathering",
      "dominant_visual": "A large group of savannah animals, including elephants, zebras, and antelopes, gathered around Ginger.",
      "mood": "warm"
    },
    {
      "page_id": "page_13",
      "page_number": 13,
      "order_index": 13,
      "order_confidence": 0.98,
      "full_text": "Böylece savanı geçerek ormana doğru büyük yolculuklarına başladılar. Güneş çok sıcaktı, yiyecek yoktu ve su içecek bir yer de yoktu. Ve sonra onu duydular. Bu gök gürültüsüydü! 'Gök gürültüsü!' diye bağırdılar hep birlikte. Gök gürültüsü savan hayvanları için çok korkutucuydu. Neden, tahmin edebilir misiniz? Yangın! Bazen yıldırım kuru otlara çarpar ve bütün savan alev alır. O zaman herkesin kaçması gerekir. Ve tam da bu oldu. 'Yangın!' diye bağırdılar. Kokusunu alabiliyorlardı. Ve şimdi görebiliyorlardı. Yangın onlara doğru geliyordu!",
      "primary_scene_hint": "fire_danger",
      "dominant_visual": "Dark storm clouds, lightning strikes, and fires erupting in the dry savannah grass.",
      "mood": "suspenseful"
    },
    {
      "page_id": "page_14",
      "page_number": 14,
      "order_index": 14,
      "order_confidence": 0.98,
      "full_text": "Ginger hızlı düşünmek zorundaydı. Çok uzun olduğu için diğer hayvanlardan daha uzağı görebiliyordu. Uzun boynunu olabildiğince yukarı uzattı. Şimdi yangın olmayan bir yer görebiliyordu. 'Çabuk!' dedi. 'Herkes bu tarafa koşsun.' Bütün hayvanlar onu takip etti ve olabildiğince hızlı koştular. Kısa süre sonra tehlikeden uzaklaştılar. Durdular ve bir kez daha bir araya toplandılar. 'Herkes burada mı?' diye sordu Ginger. Hepsinin güvende olduğundan emin olmak istedi. Bütün hayvanlar etraflarına baktılar; hepsi oradaydı.",
      "primary_scene_hint": "escape",
      "dominant_visual": "Ginger leading the animals away from the spreading fire under a dark sky.",
      "mood": "adventurous"
    },
    {
      "page_id": "page_15",
      "page_number": 15,
      "order_index": 15,
      "order_confidence": 0.98,